Ticker,Título,Enlace
GGAL,Grupo Financiero Galicia S.A. (GGAL): A Hot Stock to Buy Now,https://finance.yahoo.com/news/grupo-financiero-galicia-ggal-hot-214325547.html
GGAL,Grupo Financiero Galicia (GGAL) Upgraded to Strong Buy: Here's Why,https://finance.yahoo.com/news/grupo-financiero-galicia-ggal-upgraded-170009188.html
GGAL,Are You Looking for a Top Momentum Pick? Why Grupo Financiero Galicia (GGAL) is a Great Choice,https://finance.yahoo.com/news/looking-top-momentum-pick-why-160012254.html
GGAL,Grupo Financiero Galicia S.A. (GGAL): Leading the Way in Best Performing Cheap Stocks in 2024,https://finance.yahoo.com/news/grupo-financiero-galicia-ggal-leading-163027742.html
GGAL,Is Grupo Financiero Galicia S.A. (GGAL) the Best Performing Long Term Stock in 2024?,https://finance.yahoo.com/news/grupo-financiero-galicia-ggal-best-102619935.html
GGAL,Grupo Financiero Galicia (GGAL) Is Up 3.48% in One Week: What You Should Know,https://finance.yahoo.com/news/grupo-financiero-galicia-ggal-3-160011369.html
GGAL,Grupo Financiero Galicia (GGAL) Upgraded to Strong Buy: Here's What You Should Know,https://finance.yahoo.com/news/grupo-financiero-galicia-ggal-upgraded-160010167.html
GGAL,Is Grupo Financiero Galicia (GGAL) Among the High Growth Financial Stocks to Invest In?,https://finance.yahoo.com/news/grupo-financiero-galicia-ggal-among-131337788.html
YPF,"Zacks.com featured highlights YPF Sociedad, Telefonica, Penumbra, Deckers Outdoor and Abercrombie & Fitch",https://finance.yahoo.com/news/zacks-com-featured-highlights-ypf-084100469.html
YPF,"YPF Sociedad Anonima (YPF) Loses -19.78% in 4 Weeks, Here's Why a Trend Reversal May be Around the Corner",https://finance.yahoo.com/news/ypf-sociedad-anonima-ypf-loses-143507436.html
YPF,Should Value Investors Buy YPF Sociedad Anonima (YPF) Stock?,https://finance.yahoo.com/news/value-investors-buy-ypf-sociedad-144018400.html
YPF,Are Investors Undervaluing YPF Sociedad Anonima (YPF) Right Now?,https://finance.yahoo.com/news/investors-undervaluing-ypf-sociedad-anonima-144018663.html
YPF,"Zacks.com featured highlights include Vince, YPF Sociedad Anonima, Interface, TechnipFMC and Arlo Technologies",https://finance.yahoo.com/news/zacks-com-featured-highlights-vince-071500210.html
YPF,YPF Sociedad Anonima Signs Deal With Indian Companies for LNG Export,https://finance.yahoo.com/news/ypf-sociedad-anonima-signs-deal-114400359.html
YPF,YPF or FUPBY: Which Is the Better Value Stock Right Now?,https://finance.yahoo.com/news/ypf-fupby-better-value-stock-164013116.html
YPF,YPF Sociedad Anonima (YPF) Just Overtook the 20-Day Moving Average,https://finance.yahoo.com/news/ypf-sociedad-anonima-ypf-just-143502331.html
YPF,YPF Sociedad Anonima (YPF) Upgraded to Buy: What Does It Mean for the Stock?,https://finance.yahoo.com/news/ypf-sociedad-anonima-ypf-upgraded-170010260.html
YPF,Why Fast-paced Mover YPF Sociedad Anonima (YPF) Is a Great Choice for Value Investors,https://finance.yahoo.com/news/why-fast-paced-mover-ypf-135004597.html
MELI,"MercadoLibre, Inc. (MELI): A Bull Case Theory",https://finance.yahoo.com/news/mercadolibre-inc-meli-bull-case-221418683.html
MELI,Here's Why MercadoLibre (MELI) is a Strong Growth Stock,https://finance.yahoo.com/news/heres-why-mercadolibre-meli-strong-144512596.html
MELI,Why MercadoLibre (MELI) Stock Is Up Today,https://finance.yahoo.com/news/why-mercadolibre-meli-stock-today-202954207.html
